{
  "schema_version": 1,
  "candidate_id": "candidate_ccdfa5b1ca5299f7009f",
  "identity": {
    "problem_key": "non_prefix_kv_recurrence",
    "mechanism_key": "retrieval_control_plane_caching",
    "target_key": "agent_memory_serving"
  },
  "idea_type": "solution_concept",
  "title": "把检索层提升为KV复用控制平面触达非前缀复发",
  "problem": "agent记忆负载中73.9-76.3%的注入token在非前缀位置复发，常规前缀缓存无法触达，复用收益流失。",
  "hypothesis": "在模型执行前用检索层已有的需求信息决定缓存保留与请求路由，可在不损失答案质量下大幅降低TTFT。",
  "mechanism": "检索层作为控制平面；执行前按需求信息决策缓存保留与请求路由。",
  "target": "agent记忆与检索增强serving的缓存控制面",
  "expected_effect": "匹配请求率下平均TTFT较SGLang与LMCache+EPIC最多降3.6倍，且在基线饱和的请求率上维持低TTFT，答案质量与组合策略一致。",
  "topic_ids": [
    "cross_region"
  ],
  "origin": {
    "kind": "single_evidence",
    "trigger_issue": "2026-09-30",
    "rationale": "单条已发布记录同时给出问题、可解释机制、目标对象与可检验效应。"
  },
  "evidence": [
    {
      "item_id": "c20166db3479fce4ead49178",
      "issue_date": "2026-09-30",
      "source_urls": [
        "https://arxiv.org/abs/2609.32999v1"
      ],
      "reason": "《Tessera把检索层变成KV复用的控制平面》给出机制与对照结果。",
      "independence_group": "arxiv:2609.32999"
    }
  ],
  "evidence_item_ids": [
    "c20166db3479fce4ead49178"
  ],
  "source_urls": [
    "https://arxiv.org/abs/2609.32999v1"
  ],
  "independence_groups": [
    "arxiv:2609.32999"
  ],
  "unknowns": [
    "原型绑定EPIC组合策略",
    "高请求率下所有系统TTFT最终上升",
    "控制面决策自身的延迟开销"
  ],
  "validation_plan": {
    "mode": "prototype",
    "minimal_model": "在内部agent记忆负载上把检索需求信息接入缓存保留与路由决策，与纯前缀缓存对比。",
    "inputs": [
      "内部记忆负载trace",
      "检索需求信号",
      "缓存控制面决策器"
    ],
    "baselines": [
      "纯前缀缓存",
      "LMCache+EPIC式组合"
    ],
    "metrics": [
      "平均TTFT",
      "答案质量",
      "饱和请求率下的TTFT"
    ],
    "support_criteria": [
      "质量不变且TTFT显著下降、饱和点后移"
    ],
    "reject_criteria": [
      "控制面开销抵消收益或质量下降"
    ],
    "limitations": [
      "原始原型绑定EPIC组合策略"
    ],
    "execution_status": "suggestion_only"
  },
  "disposition": "deferred",
  "disposition_reason": "机制与效应完整，但原型绑定EPIC组合策略且高请求率上限未破，内部记忆负载适配待验证。",
  "related_candidate_ids": [],
  "related_idea_ids": [],
  "first_seen_issue": "2026-09-30",
  "last_updated_issue": "2026-09-30",
  "decision_log": [
    {
      "event_id": "candidate_decision_7d1dc8637ca3cd1a8c9",
      "issue_date": "2026-09-30",
      "decision": "deferred",
      "from_disposition": null,
      "to_disposition": "deferred",
      "reason": "机制与效应完整，但原型绑定EPIC组合策略且高请求率上限未破，内部记忆负载适配待验证。",
      "evidence_item_ids": [
        "c20166db3479fce4ead49178"
      ],
      "actor": "agent"
    }
  ]
}